Time           ack        src                   src port   Destination           dest port  Protocol Length Info       New Column
0.000821       16         10.224.0.24           48960      10.224.0.23           20035      GRPC     799               31,34

Frame 34: 799 bytes on wire (6392 bits), 799 bytes captured (6392 bits)
Linux cooked capture v1
Internet Protocol Version 4, Src: 10.224.0.24, Dst: 10.224.0.23
Transmission Control Protocol, Src Port: 48960, Dst Port: 20035, Seq: 27732, Ack: 16, Len: 731
[3 Reassembled TCP Segments (11915 bytes): #32(11184), #34(731), #35(731)]
HyperText Transfer Protocol 2
GRPC Message: /trident.Synchronizer/KubernetesAPISync, Request
Protocol Buffers: /trident.Synchronizer/KubernetesAPISync,request

Time           ack        src                   src port   Destination           dest port  Protocol Length Info       New Column
0.002018       28498      10.224.0.23           20035      10.224.0.24           48960      GRPCHTTP2 144               

Frame 66: 144 bytes on wire (1152 bits), 144 bytes captured (1152 bits)
Linux cooked capture v1
Internet Protocol Version 4, Src: 10.224.0.23, Dst: 10.224.0.24
Transmission Control Protocol, Src Port: 20035, Dst Port: 48960, Seq: 68, Ack: 28498, Len: 76
HyperText Transfer Protocol 2
HyperText Transfer Protocol 2
GRPC Message: /trident.Synchronizer/KubernetesAPISync, Response
Protocol Buffers: /trident.Synchronizer/KubernetesAPISync,response
HyperText Transfer Protocol 2

Time           ack        src                   src port   Destination           dest port  Protocol Length Info       New Column
41.044633      144        10.224.0.24           48960      10.224.0.23           20035      GRPC     495               

Frame 98: 495 bytes on wire (3960 bits), 495 bytes captured (3960 bits)
Linux cooked capture v1
Internet Protocol Version 4, Src: 10.224.0.24, Dst: 10.224.0.23
Transmission Control Protocol, Src Port: 48960, Dst Port: 20035, Seq: 28543, Ack: 144, Len: 427
[3 Reassembled TCP Segments (436 bytes): #96(9), #98(427), #99(427)]
HyperText Transfer Protocol 2
GRPC Message: /trident.Synchronizer/Push, Request
Protocol Buffers: /trident.Synchronizer/Push,request

Time           ack        src                   src port   Destination           dest port  Protocol Length Info       New Column
41.044843      28996      10.224.0.23           20035      10.224.0.24           48960      GRPC     2479              

Frame 112: 2479 bytes on wire (19832 bits), 2479 bytes captured (19832 bits)
Linux cooked capture v1
Internet Protocol Version 4, Src: 10.224.0.23, Dst: 10.224.0.24
Transmission Control Protocol, Src Port: 20035, Dst Port: 48960, Seq: 174, Ack: 28996, Len: 2411
HyperText Transfer Protocol 2
HyperText Transfer Protocol 2
GRPC Message: /trident.Synchronizer/Push, Response
Protocol Buffers: /trident.Synchronizer/Push,response

Time           ack        src                   src port   Destination           dest port  Protocol Length Info       New Column
51.934829      2585       10.224.0.24           48960      10.224.0.23           20035      GRPCHTTP2 169               

Frame 116: 169 bytes on wire (1352 bits), 169 bytes captured (1352 bits)
Linux cooked capture v1
Internet Protocol Version 4, Src: 10.224.0.24, Dst: 10.224.0.23
Transmission Control Protocol, Src Port: 48960, Dst Port: 20035, Seq: 28996, Ack: 2585, Len: 101
HyperText Transfer Protocol 2
HyperText Transfer Protocol 2
GRPC Message: /trident.Synchronizer/GenesisSync, Request
Protocol Buffers: /trident.Synchronizer/GenesisSync,request
HyperText Transfer Protocol 2

Time           ack        src                   src port   Destination           dest port  Protocol Length Info       New Column
51.935504      29114      10.224.0.23           20035      10.224.0.24           48960      GRPCHTTP2 110               

Frame 122: 110 bytes on wire (880 bits), 110 bytes captured (880 bits)
Linux cooked capture v1
Internet Protocol Version 4, Src: 10.224.0.23, Dst: 10.224.0.24
Transmission Control Protocol, Src Port: 20035, Dst Port: 48960, Seq: 2615, Ack: 29114, Len: 42
HyperText Transfer Protocol 2
HyperText Transfer Protocol 2
GRPC Message: /trident.Synchronizer/GenesisSync, Response
Protocol Buffers: /trident.Synchronizer/GenesisSync,response
HyperText Transfer Protocol 2

Time           ack        src                   src port   Destination           dest port  Protocol Length Info       New Column
51.935758      2657       10.224.0.24           48960      10.224.0.23           20035      GRPC     495               

Frame 128: 495 bytes on wire (3960 bits), 495 bytes captured (3960 bits)
Linux cooked capture v1
Internet Protocol Version 4, Src: 10.224.0.24, Dst: 10.224.0.23
Transmission Control Protocol, Src Port: 48960, Dst Port: 20035, Seq: 29159, Ack: 2657, Len: 427
[3 Reassembled TCP Segments (436 bytes): #126(9), #128(427), #129(427)]
HyperText Transfer Protocol 2
GRPC Message: /trident.Synchronizer/Sync, Request
Protocol Buffers: /trident.Synchronizer/Sync,request

Time           ack        src                   src port   Destination           dest port  Protocol Length Info       New Column
51.937094      29612      10.224.0.23           20035      10.224.0.24           48960      GRPCHTTP2 1470              

Frame 138: 1470 bytes on wire (11760 bits), 1470 bytes captured (11760 bits)
Linux cooked capture v1
Internet Protocol Version 4, Src: 10.224.0.23, Dst: 10.224.0.24
Transmission Control Protocol, Src Port: 20035, Dst Port: 48960, Seq: 2687, Ack: 29612, Len: 1402
HyperText Transfer Protocol 2
HyperText Transfer Protocol 2
GRPC Message: /trident.Synchronizer/Sync, Response
Protocol Buffers: /trident.Synchronizer/Sync,response
HyperText Transfer Protocol 2

Time           ack        src                   src port   Destination           dest port  Protocol Length Info       New Column
60.002403      4089       10.224.0.24           48960      10.224.0.23           20035      GRPCHTTP2 172               

Frame 142: 172 bytes on wire (1376 bits), 172 bytes captured (1376 bits)
Linux cooked capture v1
Internet Protocol Version 4, Src: 10.224.0.24, Dst: 10.224.0.23
Transmission Control Protocol, Src Port: 48960, Dst Port: 20035, Seq: 29612, Ack: 4089, Len: 104
HyperText Transfer Protocol 2
HyperText Transfer Protocol 2
GRPC Message: /trident.Synchronizer/KubernetesAPISync, Request
Protocol Buffers: /trident.Synchronizer/KubernetesAPISync,request
HyperText Transfer Protocol 2

Time           ack        src                   src port   Destination           dest port  Protocol Length Info       New Column
60.002591      29733      10.224.0.23           20035      10.224.0.24           48960      GRPCHTTP2 110               

Frame 148: 110 bytes on wire (880 bits), 110 bytes captured (880 bits)
Linux cooked capture v1
Internet Protocol Version 4, Src: 10.224.0.23, Dst: 10.224.0.24
Transmission Control Protocol, Src Port: 20035, Dst Port: 48960, Seq: 4119, Ack: 29733, Len: 42
HyperText Transfer Protocol 2
HyperText Transfer Protocol 2
GRPC Message: /trident.Synchronizer/KubernetesAPISync, Response
Protocol Buffers: /trident.Synchronizer/KubernetesAPISync,response
HyperText Transfer Protocol 2
